{
  "artifact_id": "migration-catalog-head-v1",
  "contract_version": "1.0",
  "artifact_state": "OFFLINE_MIGRATION_CATALOG_HEAD_BLOCKED",
  "catalog_path": "backend/migrations",
  "catalog_algorithm": "basename-ascii-ascending+sha256-raw-bytes-v1",
  "limits": {
    "max_catalog_files": 2048,
    "max_migration_bytes": 4194304,
    "max_catalog_bytes": 67108864,
    "max_migrations_per_batch": 1
  },
  "historical_prefix": {
    "migration_count": 75,
    "last_basename": "20260828_094914_d2b2b3_purpose_consent_governance_drafts.sql",
    "digest_sha256": "84ddbdb1a858c46e4cd6086698d4738574293fa4b72e122e413557a608f9097f",
    "entries": [
      {"position": 0, "name": "0001_extensions_and_enums.sql", "sha256": "5e9f7219577df7586d99168b76a898f790326058bb6891f7be667c249fe9e095", "size_bytes": 5033},
      {"position": 1, "name": "0002_schema_tables.sql", "sha256": "05da2aed2fa7de8fd1d08cc73be8a9b1be8769eda0b7012c2d9af3ef7b496aa1", "size_bytes": 20017},
      {"position": 2, "name": "0003_rls_policies.sql", "sha256": "76c3729b12aa31aeb6fcb6d4dd5177f4c92dbfe6067a5ad3ea68508c2cebb523", "size_bytes": 3195},
      {"position": 3, "name": "0004_triggers.sql", "sha256": "1c90810b491c780e80a15908409b85ba7376db93e6656fc83c916f8e8bde0ae1", "size_bytes": 8904},
      {"position": 4, "name": "0005_seed.sql", "sha256": "5ab1c7303acd696d3682d8bbc62b7f9043645bcb79f954295eb005eadc9c954f", "size_bytes": 9801},
      {"position": 5, "name": "0006_harden_function_search_path.sql", "sha256": "92127b7bcbc88904414cc6cd1e194b53bfd97405313774ea2c45a98e387d50f9", "size_bytes": 1457},
      {"position": 6, "name": "0007_remove_demo_data.sql", "sha256": "6428607e3c09c576a31fbee95f8941b548dd16afd58a60429aa37165c294d798", "size_bytes": 2735},
      {"position": 7, "name": "0008_add_operador_role.sql", "sha256": "720668417a8224312b8e6e5a2394010f2337b73f4ad007aacca7adc2a74e1972", "size_bytes": 1089},
      {"position": 8, "name": "0009_unify_system_managers.sql", "sha256": "eaaa73511fa1295714a10adc4155d92a68d17ef19f10cf90d997ecb32d20f455", "size_bytes": 2644},
      {"position": 9, "name": "0010_platform_admins.sql", "sha256": "faac32752bed6c8d797c7e22474d66d00b1ec340edf18e579cedf5dcff2f5b4e", "size_bytes": 2721},
      {"position": 10, "name": "0011_app_users_celula_pendente.sql", "sha256": "51a85bdc1527313a7beba4f18c7a2004c57af791deb63ab51bd14051f94ea103", "size_bytes": 1212},
      {"position": 11, "name": "0012_planos.sql", "sha256": "c865949b35f1b6a4e47417f24516b2fea9be69c4fe2b1ba21fb4a94b891a089d", "size_bytes": 3387},
      {"position": 12, "name": "0013_platform_audit_log.sql", "sha256": "531ef36864f79d1eee12254a2d697182fe74ff5c0bcfe6b83b9416616f0a4f40", "size_bytes": 2321},
      {"position": 13, "name": "0014_platform_orchestrator.sql", "sha256": "b52b65bad13c9369eb20816ee201f0e394bd7d1425a3d6d65c8b377777f36a56", "size_bytes": 2228},
      {"position": 14, "name": "0015_message_media.sql", "sha256": "19c9db7ac9755cc6695fb6e6a229b5b7b2a086988ed55b54847d9c131ce5e35e", "size_bytes": 2004},
      {"position": 15, "name": "0016_message_author.sql", "sha256": "8ba0f67404536d98d1c612d98eb5a6572176d8717206c6c0e805db2483aff6e3", "size_bytes": 1409},
      {"position": 16, "name": "0017_app_user_status_revogado.sql", "sha256": "3b9b0507854c3c8bd495d416910ed9e6969097d0585212a034dd041e7412e3ee", "size_bytes": 949},
      {"position": 17, "name": "20260623_103319_pessoa_sem_interesse_csim.sql", "sha256": "f9f7af60d17153a68f5e128308ae43fd0e85cc5c0350c4c7c423d02b6be3de4e", "size_bytes": 1193},
      {"position": 18, "name": "20260623_122044_calendar_sync_oauth_por_igreja.sql", "sha256": "2d8499790852468f2b8efbd7c9fbf3a1bd2121d9d2c31e162ded551c51489d18", "size_bytes": 1498},
      {"position": 19, "name": "20260623_154500_pessoa_tipo_add_contato.sql", "sha256": "17a6a35ff69ee733d83a49b1fe02f6e754407417957e0110ead906af65867abc", "size_bytes": 831},
      {"position": 20, "name": "20260623_170000_igreja_dono_assinatura.sql", "sha256": "dd89fa76271e8be836ae75c40a227fbd3b2adbf8201101db1abd9230af55004c", "size_bytes": 1333},
      {"position": 21, "name": "20260624_003030_current_igreja_id_guc_worker.sql", "sha256": "52b2417bde5d1af2827d12cfb75a6d2fc3b4d3646d0dd44a730002ac7b171090", "size_bytes": 1897},
      {"position": 22, "name": "20260624_090102_current_igreja_id_guard_empty_claims.sql", "sha256": "d89b8fa8865a130ebb7f1f31bdfaae2906e0dacdc8685946c8956d2164b367ec", "size_bytes": 1819},
      {"position": 23, "name": "20260624_171110_agent_config_requests_fila_requisicao_admin_master.sql", "sha256": "f8891c4e8233385c3eb34c202a54719ee4fff0a852463c5c460b4b327e93cf90", "size_bytes": 2265},
      {"position": 24, "name": "20260629_222635_evt1_events_agenda_schema_status_tipo_origem_recorrencia_confirmacao.sql", "sha256": "8f96b29feeee52ae79c96b29ca9e56b66a4dbed92a7add391c12a37e169ba555", "size_bytes": 5738},
      {"position": 25, "name": "20260701_014654_evt6_google_event_dedup_index.sql", "sha256": "497e51e3401ee23fe3a3ddd8ec92a27bb22dd3173a9402450d0ac16a9fb248e7", "size_bytes": 2204},
      {"position": 26, "name": "20260701_164352_evt7_events_notificado_em_aviso_confirmacao.sql", "sha256": "673d80cad9af0a6aef43162862c09e6884be38bc8392bf5f413bff4e8687d176", "size_bytes": 1130},
      {"position": 27, "name": "20260701_193000_evt7_pr2_agenda_alert_recipients.sql", "sha256": "65a9100c7c8130b6197a42e1cc198dd7b482ede8ba18f5bf46e7db3af1d96ead", "size_bytes": 2316},
      {"position": 28, "name": "20260703_123803_celula_schema_base_pr1.sql", "sha256": "09607912f73c40cce56285de6545a1b8224566de67334d2a6df4f748ccca8ec3", "size_bytes": 4639},
      {"position": 29, "name": "20260704_100000_celula_pr2_reuniao_presenca_expectativa.sql", "sha256": "af1293c536ba79909db28125a7278aeabbc5959519611320f539b4023ab9609a", "size_bytes": 7339},
      {"position": 30, "name": "20260705_120000_celula_pr3_reuniao_relatorio_campos.sql", "sha256": "689b8391f75ae212e69f3d6a50394433570031632563deae7a84f4d88306e69f", "size_bytes": 3011},
      {"position": 31, "name": "20260705_120100_celula_pr3_reuniao_registro.sql", "sha256": "c8c43027f40ee9ac5a4e7b286afcbeac8241ea398a2f8c80e26796a3065ceeff", "size_bytes": 2459},
      {"position": 32, "name": "20260705_120200_celula_pr3_visitante.sql", "sha256": "ecd7328b95df43a82cd3ae6e9bf1261f9cc1e257ccf67a6614c716b2f3a18afe", "size_bytes": 2315},
      {"position": 33, "name": "20260705_120300_celula_pr3_solicitacao_evento.sql", "sha256": "8a1ffcd7947ca68689ae8970944a50b2fcd0858eb7f395f3b7fad1e06c442bf1", "size_bytes": 7096},
      {"position": 34, "name": "20260705_120400_celula_pr3_aviso.sql", "sha256": "aee8a18764a3ec0fe53efb3d802ed05d3519db90e4763c47b1c14e4e2b5ac263", "size_bytes": 2864},
      {"position": 35, "name": "20260705_120500_celula_pr3_material.sql", "sha256": "d39c83f2023160a98211160212b4724f70525f3777b0011ce192132f00d68922", "size_bytes": 2164},
      {"position": 36, "name": "20260705_120600_celula_pr3_multiplicacoes_evolucao.sql", "sha256": "3846299ac5c06abc750028c8cb91844de8ff82eac584af49c8ebc53ab777f4a2", "size_bytes": 5705},
      {"position": 37, "name": "20260706_221311_pessoas_apto_lider_e_converte_legado_tipo_lider.sql", "sha256": "ee557f4bcdf50fb8ec3e6f0a6e82046cf519f2f0523ea40a81e4d27d0fdaf2e0", "size_bytes": 2729},
      {"position": 38, "name": "20260706_230000_evt8_pr1_notify_config.sql", "sha256": "1c172564734812522466fd6cc20087c0a8af3d8673dde4882ea4a807fa3d9b71", "size_bytes": 3937},
      {"position": 39, "name": "20260707_011455_igreja_logo_branding.sql", "sha256": "dbebd871c779d6dac52f6c6dfe5cecef8e054c59236fe52d774eb4b746ae069d", "size_bytes": 3362},
      {"position": 40, "name": "20260708_160128_sec3a_app_users_password_changed_at.sql", "sha256": "6e6efad7a4ca0a4062496e1854a9ada1d85b1acdd1e2bd12c041c9d982cf79e6", "size_bytes": 1237},
      {"position": 41, "name": "20260708_164756_backfill_celula_membro_canonico.sql", "sha256": "614419cf2e6122b2b6438a3fda9cc27adebd47d3a88b44e5e2fa2909ed19d803", "size_bytes": 3866},
      {"position": 42, "name": "20260708_172106_sec3b_password_reset_tokens_single_use.sql", "sha256": "9a9ba9f5059c97db68053fbac4ff91adedbbbe8c0111c2909623e910a60951f3", "size_bytes": 2178},
      {"position": 43, "name": "20260708_221808_igreja_dono_id_grant_update.sql", "sha256": "18afa38fb59fe9aca65a467732da9d38926d3b8921d1d83ab1acad9f235d265d", "size_bytes": 1377},
      {"position": 44, "name": "20260709_204500_sec4_agent_event_idempotency_marker_uidx.sql", "sha256": "11fdad1ad9aca3e1eb1c627cb551083e94b98bc948b73b0e6cb0c77a6ad3a34f", "size_bytes": 3031},
      {"position": 45, "name": "20260711_023515_backfill_pessoa_tipo_membro_por_vinculo_ativo.sql", "sha256": "d8b55db78f765d48006b739d2b3524f00e7ad059a342b92ac78ae7c6b336408c", "size_bytes": 3556},
      {"position": 46, "name": "20260711_152127_reclassifica_pessoa_do_numero_whatsapp_fora_de_membro.sql", "sha256": "e4112a55e5cde97fd9e8b409d418c00ae85857b121c7e277ba8c8e3472603edf", "size_bytes": 5490},
      {"position": 47, "name": "20260711_224403_celula_solicitacao_e13_open_unique.sql", "sha256": "0afeb7815d8f532cd53fdfc97ff7f41e08e142914faa5350848df4c3845aa295", "size_bytes": 3535},
      {"position": 48, "name": "20260713_013054_pessoa_arquivamento_schema.sql", "sha256": "de5974001f0cc8cf9ea81a83bac9ff855a4f357940e4ba26a869a3c4f95461fa", "size_bytes": 1347},
      {"position": 49, "name": "20260713_032015_pessoa_offboarding_preflight_arquivamento_evento.sql", "sha256": "38ec86859577aa1bd7a92e7f37068746d63f8aa3c8bd995e012624725bf2ebef", "size_bytes": 5925},
      {"position": 50, "name": "20260715_204540_msg_idemp1_messages_inbound_provider_id_uidx.sql", "sha256": "bc0de9a9f9cd72d6c0b48b59b343331fb2d0a6e3e486afc6144b439801918949", "size_bytes": 3129},
      {"position": 51, "name": "20260715_204541_consolidacao_aberta_unica_por_pessoa.sql", "sha256": "9c35fdb7688f96b4f7ce911bd3b55d9779fb6ae471998778ae148f463bcfbfdf", "size_bytes": 3049},